{
  "$schema": "https://json-schema.org/draft/2020-12/schema",
  "$id": "https://permdock.com/schemas/catalog-v1.json",
  "type": "object",
  "required": [
    "$schema",
    "version",
    "generatedAt",
    "generator",
    "resources",
    "permissions"
  ],
  "properties": {
    "$schema": {
      "type": "string"
    },
    "version": {
      "const": 1
    },
    "generatedAt": {
      "type": "string"
    },
    "generator": {
      "type": "string"
    },
    "fingerprint": {
      "type": "string"
    },
    "resources": {
      "type": "object",
      "additionalProperties": {
        "type": "object",
        "required": ["id", "schema"],
        "properties": {
          "id": {
            "type": "string"
          },
          "schema": {},
          "definedIn": {
            "type": "string"
          },
          "parent": {
            "type": "object",
            "required": ["field", "resource"],
            "properties": {
              "field": {
                "type": "string"
              },
              "resource": {
                "type": "string"
              }
            }
          },
          "links": {
            "type": "object",
            "additionalProperties": {
              "type": "object",
              "required": ["field", "resource"],
              "properties": {
                "field": {
                  "type": "string"
                },
                "resource": {
                  "type": "string"
                }
              }
            }
          },
          "disclosure": {
            "const": "hide"
          },
          "relations": {
            "type": "object"
          },
          "version": {
            "type": "string"
          },
          "restricted": {
            "type": "string"
          },
          "restrictedStops": {
            "type": "array",
            "items": {
              "type": "string"
            }
          },
          "meta": {
            "type": "object"
          }
        }
      }
    },
    "roles": {
      "type": "array",
      "items": {
        "type": "object",
        "required": ["key"],
        "properties": {
          "key": {
            "type": "string"
          },
          "on": {
            "type": "string",
            "pattern": "^[a-z][a-z0-9_]*$"
          },
          "assignable": {
            "type": "boolean"
          },
          "min": {
            "type": "integer",
            "minimum": 1
          },
          "max": {
            "type": "integer",
            "minimum": 1
          },
          "transferOnly": {
            "const": true
          },
          "assigns": {
            "type": "array",
            "items": {
              "type": "string"
            }
          },
          "for": {
            "type": "array",
            "items": {
              "type": "string"
            }
          },
          "exclusiveWith": {
            "type": "array",
            "items": {
              "type": "string"
            }
          },
          "audience": {
            "type": "string"
          },
          "activation": {
            "type": "object",
            "required": ["justification"],
            "properties": {
              "maxDuration": {
                "type": "integer",
                "minimum": 1
              },
              "justification": {
                "enum": ["required", "optional"]
              },
              "approval": {
                "type": "boolean"
              },
              "assurance": {
                "type": "object"
              }
            }
          },
          "supportAccess": {
            "type": "object",
            "required": ["actorRequired", "group", "durations"],
            "properties": {
              "actorRequired": {
                "type": "boolean"
              },
              "group": {
                "type": "string"
              },
              "durations": {
                "type": "array",
                "items": {
                  "type": "integer",
                  "minimum": 1
                }
              }
            }
          }
        }
      }
    },
    "scopes": {
      "type": "array",
      "items": {
        "type": "object",
        "required": ["name", "key"],
        "properties": {
          "name": {
            "type": "string",
            "pattern": "^[a-z][a-z0-9_]*$"
          },
          "key": {
            "type": "string"
          },
          "within": {
            "type": "string"
          }
        }
      }
    },
    "plans": {
      "type": "array",
      "items": {
        "type": "object",
        "required": ["key"],
        "properties": {
          "key": {
            "type": "string"
          }
        }
      }
    },
    "permissions": {
      "type": "array",
      "items": {
        "type": "object",
        "required": [
          "key",
          "scope",
          "resource",
          "action",
          "arity",
          "meta",
          "usages",
          "rowConditions"
        ],
        "properties": {
          "key": {
            "type": "string"
          },
          "scope": {
            "type": "string"
          },
          "resource": {
            "type": "string"
          },
          "action": {
            "type": "string"
          },
          "arity": {
            "enum": ["instance", "collection"]
          },
          "meta": {
            "type": "object"
          },
          "usages": {
            "type": "array",
            "items": {
              "type": "object",
              "required": ["file", "line", "call"],
              "properties": {
                "file": {
                  "type": "string"
                },
                "line": {
                  "type": "integer",
                  "minimum": 0
                },
                "call": {
                  "type": "string"
                }
              }
            }
          },
          "renamedFrom": {
            "type": "array",
            "items": {
              "type": "string"
            }
          },
          "levels": {
            "type": "array",
            "items": {
              "type": "string"
            }
          },
          "orderedLevels": {
            "const": true
          },
          "hostable": {
            "const": true
          },
          "rowConditions": {
            "type": "boolean"
          },
          "approvals": {
            "type": "array",
            "items": {
              "oneOf": [
                {
                  "const": "human"
                },
                {
                  "type": "object",
                  "properties": {
                    "by": {},
                    "combine": {
                      "enum": ["any", "all", "sequential"]
                    },
                    "mode": {
                      "description": "confirm or authorize; a catalog written before 0.17 holds any, all or sequential here, read as combine.",
                      "enum": [
                        "confirm",
                        "authorize",
                        "any",
                        "all",
                        "sequential"
                      ]
                    },
                    "stages": {
                      "type": "array",
                      "items": {
                        "type": "object",
                        "required": ["by"],
                        "properties": {
                          "by": {},
                          "quorum": {
                            "type": "integer",
                            "minimum": 1
                          }
                        }
                      }
                    },
                    "distinct": {
                      "description": "Written before 0.17; false reads as mode: confirm.",
                      "type": "boolean"
                    },
                    "staleOn": {
                      "const": "resource-change"
                    },
                    "quorum": {
                      "type": "integer",
                      "minimum": 1
                    },
                    "ttl": {
                      "type": "integer",
                      "minimum": 1
                    },
                    "escalation": {
                      "type": "object",
                      "required": ["after", "to"],
                      "properties": {
                        "after": {
                          "type": "integer",
                          "minimum": 1
                        },
                        "to": {}
                      }
                    }
                  }
                }
              ]
            }
          },
          "breakGlass": {
            "type": "object",
            "required": ["overrides", "reason", "obligations"],
            "properties": {
              "overrides": {
                "type": "array",
                "items": {
                  "type": "string"
                }
              },
              "purpose": {
                "type": "array",
                "items": {
                  "type": "string"
                }
              },
              "reason": {
                "type": "boolean"
              },
              "maxDuration": {
                "type": "integer",
                "minimum": 1
              },
              "obligations": {
                "type": "array",
                "items": {
                  "type": "string"
                }
              }
            }
          }
        }
      }
    },
    "grants": {
      "type": "array",
      "items": {
        "type": "object",
        "required": ["permission", "effect", "role", "to", "scope"],
        "properties": {
          "permission": {
            "type": "string"
          },
          "effect": {
            "enum": ["allow", "deny"]
          },
          "role": {
            "oneOf": [
              {
                "type": "string"
              },
              {
                "const": null
              }
            ]
          },
          "to": {},
          "scope": {
            "oneOf": [
              {
                "type": "string"
              },
              {
                "type": "object",
                "required": ["resource"],
                "properties": {
                  "resource": {
                    "type": "string"
                  }
                }
              }
            ]
          },
          "where": {},
          "check": {},
          "approval": {
            "oneOf": [
              {
                "const": "human"
              },
              {
                "type": "object",
                "properties": {
                  "by": {},
                  "combine": {
                    "enum": ["any", "all", "sequential"]
                  },
                  "mode": {
                    "description": "confirm or authorize; a catalog written before 0.17 holds any, all or sequential here, read as combine.",
                    "enum": ["confirm", "authorize", "any", "all", "sequential"]
                  },
                  "stages": {
                    "type": "array",
                    "items": {
                      "type": "object",
                      "required": ["by"],
                      "properties": {
                        "by": {},
                        "quorum": {
                          "type": "integer",
                          "minimum": 1
                        }
                      }
                    }
                  },
                  "distinct": {
                    "description": "Written before 0.17; false reads as mode: confirm.",
                    "type": "boolean"
                  },
                  "staleOn": {
                    "const": "resource-change"
                  },
                  "quorum": {
                    "type": "integer",
                    "minimum": 1
                  },
                  "ttl": {
                    "type": "integer",
                    "minimum": 1
                  },
                  "escalation": {
                    "type": "object",
                    "required": ["after", "to"],
                    "properties": {
                      "after": {
                        "type": "integer",
                        "minimum": 1
                      },
                      "to": {}
                    }
                  }
                }
              }
            ]
          },
          "fields": {
            "type": "array",
            "items": {
              "type": "string"
            }
          },
          "validity": {
            "type": "object",
            "properties": {
              "from": {
                "type": "string",
                "format": "date-time",
                "pattern": "^\\d{4}-\\d{2}-\\d{2}T\\d{2}:\\d{2}:\\d{2}(?:\\.\\d+)?(?:Z|[+-]\\d{2}:\\d{2})$"
              },
              "until": {
                "type": "string",
                "format": "date-time",
                "pattern": "^\\d{4}-\\d{2}-\\d{2}T\\d{2}:\\d{2}:\\d{2}(?:\\.\\d+)?(?:Z|[+-]\\d{2}:\\d{2})$"
              }
            }
          },
          "name": {
            "type": "string"
          },
          "purpose": {
            "type": "array",
            "items": {
              "type": "string"
            }
          },
          "requires": {
            "oneOf": [
              {
                "type": "string"
              },
              {
                "type": "array",
                "items": {
                  "type": "string"
                }
              }
            ]
          },
          "limit": {
            "type": "object",
            "required": ["count", "per"],
            "properties": {
              "count": {
                "type": "integer",
                "minimum": 1
              },
              "per": {
                "type": "integer",
                "minimum": 1
              },
              "mode": {
                "enum": ["hard", "soft"]
              }
            }
          },
          "portable": {
            "const": false
          },
          "meta": {
            "type": "object"
          }
        }
      }
    },
    "delegations": {
      "type": "array",
      "items": {
        "type": "object",
        "required": ["from", "to", "permissions"],
        "properties": {
          "from": {},
          "to": {
            "type": "object",
            "required": ["kind"],
            "properties": {
              "kind": {
                "type": "string"
              },
              "id": {
                "type": "string"
              },
              "client": {
                "type": "string"
              }
            }
          },
          "permissions": {
            "type": "array",
            "items": {
              "type": "string"
            }
          },
          "validity": {
            "type": "object",
            "properties": {
              "from": {
                "type": "string",
                "format": "date-time",
                "pattern": "^\\d{4}-\\d{2}-\\d{2}T\\d{2}:\\d{2}:\\d{2}(?:\\.\\d+)?(?:Z|[+-]\\d{2}:\\d{2})$"
              },
              "until": {
                "type": "string",
                "format": "date-time",
                "pattern": "^\\d{4}-\\d{2}-\\d{2}T\\d{2}:\\d{2}:\\d{2}(?:\\.\\d+)?(?:Z|[+-]\\d{2}:\\d{2})$"
              }
            }
          }
        }
      }
    },
    "operations": {
      "type": "array",
      "items": {
        "type": "object",
        "required": ["name", "permission", "meta"],
        "properties": {
          "name": {
            "type": "string",
            "pattern": "^[A-Za-z0-9_.-]{1,128}$"
          },
          "permission": {
            "type": "string"
          },
          "results": {
            "type": "string"
          },
          "meta": {
            "type": "object",
            "additionalProperties": false,
            "properties": {
              "risk": {
                "enum": ["low", "medium", "high", "critical"]
              },
              "effects": {
                "type": "array",
                "uniqueItems": true,
                "items": {
                  "enum": [
                    "read",
                    "write",
                    "delete",
                    "send",
                    "spend",
                    "external"
                  ]
                }
              },
              "title": {
                "type": "string",
                "minLength": 1
              }
            }
          }
        }
      }
    },
    "oauthScopes": {
      "type": "array",
      "items": {
        "type": "object",
        "required": ["scope", "permissions"],
        "properties": {
          "scope": {
            "type": "string",
            "minLength": 1
          },
          "permissions": {
            "type": "array",
            "items": {
              "type": "string"
            }
          }
        }
      }
    }
  }
}
