{
  "$schema": "https://permdock.dev/schemas/catalog-v1.json",
  "version": 1,
  "generatedAt": "2026-10-03T15:41:22.570Z",
  "generator": "permdock@0.1.0-next.2",
  "fingerprint": "itzidnD54Sh0kfmC1o5xApt5bNhOpAvsmfAUzq15_Mo",
  "resources": {
    "project": {
      "id": "id",
      "schema": null,
      "relations": {
        "org": {
          "field": "orgId",
          "memberOf": "tenant"
        }
      }
    },
    "doc": {
      "id": "id",
      "schema": null,
      "relations": {
        "org": {
          "field": "orgId",
          "memberOf": "tenant"
        },
        "team": {
          "field": "teamId",
          "memberOf": "team"
        }
      }
    },
    "folder": {
      "id": "id",
      "schema": null,
      "relations": {
        "org": {
          "field": "orgId",
          "memberOf": "tenant"
        },
        "viewer": {
          "edge": "folder_share",
          "object": "folder_id",
          "expiresAt": "expires_at"
        },
        "editor": {
          "edge": "folder_editor",
          "object": "folder_id"
        }
      },
      "restricted": "restricted"
    },
    "member": {
      "id": "id",
      "schema": null
    },
    "settings": {
      "id": "id",
      "schema": null
    },
    "billing": {
      "id": "id",
      "schema": null
    },
    "analytics": {
      "id": "id",
      "schema": null
    },
    "audit": {
      "id": "id",
      "schema": null
    },
    "sso": {
      "id": "id",
      "schema": null
    },
    "apiKey": {
      "id": "id",
      "schema": null
    },
    "integration": {
      "id": "id",
      "schema": null
    }
  },
  "permissions": [
    {
      "key": "analytics.read",
      "scope": "analytics:read",
      "resource": "analytics",
      "action": "read",
      "arity": "collection",
      "meta": {},
      "usages": [],
      "rowConditions": true
    },
    {
      "key": "apiKey.create",
      "scope": "apiKey:create",
      "resource": "apiKey",
      "action": "create",
      "arity": "collection",
      "meta": {},
      "usages": [],
      "rowConditions": true
    },
    {
      "key": "apiKey.manage",
      "scope": "apiKey:manage",
      "resource": "apiKey",
      "action": "manage",
      "arity": "collection",
      "meta": {},
      "usages": [],
      "rowConditions": true
    },
    {
      "key": "apiKey.revokeAll",
      "scope": "apiKey:revokeAll",
      "resource": "apiKey",
      "action": "revokeAll",
      "arity": "collection",
      "meta": {},
      "usages": [],
      "rowConditions": true
    },
    {
      "key": "audit.read",
      "scope": "audit:read",
      "resource": "audit",
      "action": "read",
      "arity": "collection",
      "meta": {},
      "usages": [],
      "rowConditions": true
    },
    {
      "key": "billing.manage",
      "scope": "billing:manage",
      "resource": "billing",
      "action": "manage",
      "arity": "collection",
      "meta": {},
      "usages": [],
      "rowConditions": true
    },
    {
      "key": "billing.read",
      "scope": "billing:read",
      "resource": "billing",
      "action": "read",
      "arity": "collection",
      "meta": {},
      "usages": [],
      "rowConditions": true
    },
    {
      "key": "doc.create",
      "scope": "doc:create",
      "resource": "doc",
      "action": "create",
      "arity": "collection",
      "meta": {},
      "usages": [],
      "rowConditions": true
    },
    {
      "key": "doc.delete",
      "scope": "doc:delete",
      "resource": "doc",
      "action": "delete",
      "arity": "instance",
      "meta": {
        "destructive": true
      },
      "usages": [],
      "rowConditions": true
    },
    {
      "key": "doc.list",
      "scope": "doc:list",
      "resource": "doc",
      "action": "list",
      "arity": "collection",
      "meta": {
        "readOnly": true
      },
      "usages": [],
      "rowConditions": true
    },
    {
      "key": "doc.read",
      "scope": "doc:read",
      "resource": "doc",
      "action": "read",
      "arity": "instance",
      "meta": {
        "readOnly": true
      },
      "usages": [],
      "rowConditions": true
    },
    {
      "key": "doc.update",
      "scope": "doc:update",
      "resource": "doc",
      "action": "update",
      "arity": "instance",
      "meta": {},
      "usages": [],
      "rowConditions": true
    },
    {
      "key": "folder.create",
      "scope": "folder:create",
      "resource": "folder",
      "action": "create",
      "arity": "collection",
      "meta": {},
      "usages": [],
      "rowConditions": true
    },
    {
      "key": "folder.delete",
      "scope": "folder:delete",
      "resource": "folder",
      "action": "delete",
      "arity": "instance",
      "meta": {
        "destructive": true
      },
      "usages": [],
      "rowConditions": true
    },
    {
      "key": "folder.list",
      "scope": "folder:list",
      "resource": "folder",
      "action": "list",
      "arity": "collection",
      "meta": {
        "readOnly": true
      },
      "usages": [],
      "rowConditions": true
    },
    {
      "key": "folder.read",
      "scope": "folder:read",
      "resource": "folder",
      "action": "read",
      "arity": "instance",
      "meta": {
        "readOnly": true
      },
      "usages": [],
      "rowConditions": true
    },
    {
      "key": "folder.update",
      "scope": "folder:update",
      "resource": "folder",
      "action": "update",
      "arity": "instance",
      "meta": {},
      "usages": [],
      "rowConditions": true
    },
    {
      "key": "integration.read",
      "scope": "integration:read",
      "resource": "integration",
      "action": "read",
      "arity": "collection",
      "meta": {},
      "usages": [],
      "rowConditions": true
    },
    {
      "key": "member.assignRole",
      "scope": "member:assignRole",
      "resource": "member",
      "action": "assignRole",
      "arity": "collection",
      "meta": {},
      "usages": [],
      "rowConditions": true
    },
    {
      "key": "member.invite",
      "scope": "member:invite",
      "resource": "member",
      "action": "invite",
      "arity": "collection",
      "meta": {},
      "usages": [],
      "rowConditions": true
    },
    {
      "key": "member.list",
      "scope": "member:list",
      "resource": "member",
      "action": "list",
      "arity": "collection",
      "meta": {},
      "usages": [],
      "rowConditions": true
    },
    {
      "key": "project.create",
      "scope": "project:create",
      "resource": "project",
      "action": "create",
      "arity": "collection",
      "meta": {},
      "usages": [],
      "rowConditions": true
    },
    {
      "key": "project.delete",
      "scope": "project:delete",
      "resource": "project",
      "action": "delete",
      "arity": "instance",
      "meta": {
        "destructive": true
      },
      "usages": [],
      "rowConditions": true
    },
    {
      "key": "project.list",
      "scope": "project:list",
      "resource": "project",
      "action": "list",
      "arity": "collection",
      "meta": {
        "readOnly": true
      },
      "usages": [
        {
          "file": "src/app/[org]/page.tsx",
          "line": 15,
          "call": "can"
        }
      ],
      "rowConditions": true
    },
    {
      "key": "project.read",
      "scope": "project:read",
      "resource": "project",
      "action": "read",
      "arity": "instance",
      "meta": {
        "readOnly": true
      },
      "usages": [
        {
          "file": "src/app/[org]/page.tsx",
          "line": 22,
          "call": "filter"
        }
      ],
      "rowConditions": true
    },
    {
      "key": "project.update",
      "scope": "project:update",
      "resource": "project",
      "action": "update",
      "arity": "instance",
      "meta": {},
      "usages": [
        {
          "file": "src/app/[org]/page.tsx",
          "line": 27,
          "call": "can"
        }
      ],
      "rowConditions": true
    },
    {
      "key": "settings.manage",
      "scope": "settings:manage",
      "resource": "settings",
      "action": "manage",
      "arity": "collection",
      "meta": {},
      "usages": [],
      "rowConditions": true
    },
    {
      "key": "sso.manage",
      "scope": "sso:manage",
      "resource": "sso",
      "action": "manage",
      "arity": "collection",
      "meta": {},
      "usages": [],
      "rowConditions": true
    }
  ]
}
